id,node_id,name,full_name,private,html_url,description,fork,url,created_at,updated_at,pushed_at,homepage,size,stargazers_count,watchers_count,language,has_issues,has_projects,has_downloads,has_wiki,has_pages,has_discussions,forks_count,mirror_url,archived,disabled,open_issues_count,allow_forking,is_template,web_commit_signoff_required,topics,visibility,forks,open_issues,watchers,default_branch,owner.login,owner.id,owner.node_id,owner.type,owner.user_view_type,owner.site_admin,license.key,license.name,license.spdx_id,license.url,license.node_id,permissions.admin,permissions.maintain,permissions.push,permissions.triage,permissions.pull,license
34086375,MDEwOlJlcG9zaXRvcnkzNDA4NjM3NQ==,baseliner4,Coweeta/baseliner4,False,https://github.com/Coweeta/baseliner4,MATLAB code for processing sap flux measurements from thermal dissipation (Granier-type) probes. This package needs to be run within the MATLAB software environment.. ,True,https://api.github.com/repos/Coweeta/baseliner4,2015-04-16T23:40:39Z,2023-04-08T11:51:12Z,2022-12-06T16:24:34Z,,5427,2,2,MATLAB,False,True,True,True,False,False,3,,False,False,0,True,False,False,['sapflux'],public,3,0,2,master,Coweeta,11986160,MDEyOk9yZ2FuaXphdGlvbjExOTg2MTYw,Organization,public,False,gpl-3.0,GNU General Public License v3.0,GPL-3.0,https://api.github.com/licenses/gpl-3.0,MDc6TGljZW5zZTk=,False,False,False,False,True,
58156503,MDEwOlJlcG9zaXRvcnk1ODE1NjUwMw==,Baseliner4_exe,Coweeta/Baseliner4_exe,False,https://github.com/Coweeta/Baseliner4_exe,Windows-based software application for processing data from thermal dissipation sap flux probes. Does not require MATLAB software. ,False,https://api.github.com/repos/Coweeta/Baseliner4_exe,2016-05-05T19:48:16Z,2024-02-14T16:58:33Z,2022-12-19T15:37:42Z,,22698,4,4,,True,True,True,True,False,False,2,,False,False,0,True,False,False,[],public,2,0,4,master,Coweeta,11986160,MDEyOk9yZ2FuaXphdGlvbjExOTg2MTYw,Organization,public,False,,,,,,False,False,False,False,True,
59694505,MDEwOlJlcG9zaXRvcnk1OTY5NDUwNQ==,rhodo-plot-mapper,Coweeta/rhodo-plot-mapper,False,https://github.com/Coweeta/rhodo-plot-mapper,Python code to drive an LTI TruPulse laser range finder for mapping trees in a study plot.,False,https://api.github.com/repos/Coweeta/rhodo-plot-mapper,2016-05-25T20:15:04Z,2016-05-25T20:17:51Z,2016-05-25T20:59:40Z,,21,0,0,Python,True,True,True,True,False,False,0,,False,False,0,True,False,False,[],public,0,0,0,master,Coweeta,11986160,MDEyOk9yZ2FuaXphdGlvbjExOTg2MTYw,Organization,public,False,bsd-3-clause,"BSD 3-Clause ""New"" or ""Revised"" License",BSD-3-Clause,https://api.github.com/licenses/bsd-3-clause,MDc6TGljZW5zZTU=,False,False,False,False,True,
84326097,MDEwOlJlcG9zaXRvcnk4NDMyNjA5Nw==,datalogger_tools,Coweeta/datalogger_tools,False,https://github.com/Coweeta/datalogger_tools,A library for an Arduino based datalogger and a corresponding GUI management tool.,False,https://api.github.com/repos/Coweeta/datalogger_tools,2017-03-08T13:57:13Z,2017-06-16T20:31:27Z,2017-11-13T04:09:49Z,,120,0,0,Python,True,True,True,True,False,False,0,,False,False,0,True,False,False,['arduino'],public,0,0,0,master,Coweeta,11986160,MDEyOk9yZ2FuaXphdGlvbjExOTg2MTYw,Organization,public,False,gpl-3.0,GNU General Public License v3.0,GPL-3.0,https://api.github.com/licenses/gpl-3.0,MDc6TGljZW5zZTk=,False,False,False,False,True,
91285672,MDEwOlJlcG9zaXRvcnk5MTI4NTY3Mg==,sapflux-heater,Coweeta/sapflux-heater,False,https://github.com/Coweeta/sapflux-heater,Circuit to control heater elements in sapflux experiments,False,https://api.github.com/repos/Coweeta/sapflux-heater,2017-05-15T02:06:41Z,2017-06-16T20:31:59Z,2021-11-09T23:13:56Z,,2392,0,0,Jupyter Notebook,True,True,True,True,False,False,1,,False,False,1,True,False,False,['kicad'],public,1,1,0,master,Coweeta,11986160,MDEyOk9yZ2FuaXphdGlvbjExOTg2MTYw,Organization,public,False,,,,,,False,False,False,False,True,
153799872,MDEwOlJlcG9zaXRvcnkxNTM3OTk4NzI=,Baseliner_HRM,Coweeta/Baseliner_HRM,False,https://github.com/Coweeta/Baseliner_HRM,Prototype version of Baseliner software adapted for heat ratio method sensors. Note: only works with heat ratio probe data--does not work with Granier/thermal dissipation probes. Use the normal Baseliner program for thermal dissipation probes. ,False,https://api.github.com/repos/Coweeta/Baseliner_HRM,2018-10-19T14:57:26Z,2019-11-22T19:58:32Z,2019-11-06T18:18:00Z,,68,0,0,MATLAB,True,True,True,True,False,False,0,,False,False,0,True,False,False,[],public,0,0,0,master,Coweeta,11986160,MDEyOk9yZ2FuaXphdGlvbjExOTg2MTYw,Organization,public,False,gpl-3.0,GNU General Public License v3.0,GPL-3.0,https://api.github.com/licenses/gpl-3.0,MDc6TGljZW5zZTk=,False,False,False,False,True,
